{
  "version": "1.0",
  "build_timestamp": "2026-02-27T18:13:14.511669",
  "identities": [
    {
      "email_address": "naveed.ahmed@systemsltd.com",
      "canonical_name": "Muhammad Naveed Ahmad (naveed.ahmed@systemsltd.com)",
      "aliases": [
        "Muhammad Naveed Ahmad",
        "Muhammad Naveed Ahmad (naveed.ahmed@systemsltd.com)",
        "Muhammad Usman Saeed (JIRA)",
        "Shafaq Haroon (JIRA)",
        "naveed.ahmed@systemsltd.com"
      ],
      "pseudonym_id": "PERSON_001",
      "email_count": 512
    },
    {
      "email_address": "imran.mir@systemsltd.com",
      "canonical_name": "Imran Mir (imran.mir@systemsltd.com)",
      "aliases": [
        "Imran Mir",
        "Imran Mir (imran.mir@systemsltd.com)"
      ],
      "pseudonym_id": "PERSON_002",
      "email_count": 490
    },
    {
      "email_address": "team-ar@systemsltd.com",
      "canonical_name": "Team-AR@systemsltd.com",
      "aliases": [
        "Team-AR",
        "Team-AR@systemsltd.com"
      ],
      "pseudonym_id": "PERSON_003",
      "email_count": 1080
    },
    {
      "email_address": "kashif.azam@systemsltd.com",
      "canonical_name": "Kashif Azam SL",
      "aliases": [
        "Kashif Azam",
        "Kashif Azam SL"
      ],
      "pseudonym_id": "PERSON_004",
      "email_count": 431
    },
    {
      "email_address": "zahid.janjua@visionetsystems.com",
      "canonical_name": "Zahid Janjua (Zahid.Janjua@visionetsystems.com)",
      "aliases": [
        "Zahid Janjua",
        "Zahid Janjua (Zahid.Janjua@visionetsystems.com)"
      ],
      "pseudonym_id": "PERSON_005",
      "email_count": 908
    },
    {
      "email_address": "muhammadrafiq.asim@systemsltd.com",
      "canonical_name": "Muhammad Rafiq (muhammadrafiq.asim@systemsltd.com)",
      "aliases": [
        "Muhammad Rafiq",
        "Muhammad Rafiq (muhammadrafiq.asim@systemsltd.com)",
        "muhammadrafiq.asim@systemsltd.com"
      ],
      "pseudonym_id": "PERSON_006",
      "email_count": 1169
    },
    {
      "email_address": "faisal.shahzad@systemsltd.com",
      "canonical_name": "Faisal Shahzad",
      "aliases": [
        "Faisal Shahzad"
      ],
      "pseudonym_id": "PERSON_007",
      "email_count": 98
    },
    {
      "email_address": "zia.murtaza@systemsltd.com",
      "canonical_name": "Zia Ul Murtaza",
      "aliases": [
        "Zia Ul Murtaza"
      ],
      "pseudonym_id": "PERSON_008",
      "email_count": 149
    },
    {
      "email_address": "fahad.mehmood@systemsltd.com",
      "canonical_name": "Fahad Mehmood",
      "aliases": [
        "Fahad Mehmood"
      ],
      "pseudonym_id": "PERSON_009",
      "email_count": 40
    },
    {
      "email_address": "muhammad.salman@systemsltd.com",
      "canonical_name": "Muhammad Salman",
      "aliases": [
        "Muhammad Salman"
      ],
      "pseudonym_id": "PERSON_010",
      "email_count": 71
    },
    {
      "email_address": "zahid.janjua@systemsltd.com",
      "canonical_name": "Zahid Janjua",
      "aliases": [
        "Zahid Janjua"
      ],
      "pseudonym_id": "PERSON_011",
      "email_count": 99
    },
    {
      "email_address": "madhu.b@visionetsystems.com",
      "canonical_name": "Madhu Srinivasan (madhu.b@visionetsystems.com)",
      "aliases": [
        "Madhu Srinivasan",
        "Madhu Srinivasan (madhu.b@visionetsystems.com)",
        "madhu.b@visionetsystems.com"
      ],
      "pseudonym_id": "PERSON_012",
      "email_count": 125
    },
    {
      "email_address": "arif.zia@systemsltd.com",
      "canonical_name": "Muhammad Arif Zia",
      "aliases": [
        "Arif Zia",
        "Muhammad Arif Zia"
      ],
      "pseudonym_id": "PERSON_013",
      "email_count": 173
    },
    {
      "email_address": "asif.ali@systemsltd.com",
      "canonical_name": "Asif Ali",
      "aliases": [
        "Asif Ali"
      ],
      "pseudonym_id": "PERSON_014",
      "email_count": 81
    },
    {
      "email_address": "muhammad.masood@systemsltd.com",
      "canonical_name": "Muhammad Masood",
      "aliases": [
        "Muhammad Masood"
      ],
      "pseudonym_id": "PERSON_015",
      "email_count": 48
    },
    {
      "email_address": "zawar.ahmad@systemsltd.com",
      "canonical_name": "Zawar Ahmad",
      "aliases": [
        "Zawar Ahmad"
      ],
      "pseudonym_id": "PERSON_016",
      "email_count": 22
    },
    {
      "email_address": "muhammad.yaseen@systemsltd.com",
      "canonical_name": "Muhammad Yaseen",
      "aliases": [
        "Muhammad Yaseen"
      ],
      "pseudonym_id": "PERSON_017",
      "email_count": 50
    },
    {
      "email_address": "mudassar.jamil@systemsltd.com",
      "canonical_name": "Mudassar Jamil (Mudassar.Jamil@systemsltd.com)",
      "aliases": [
        "Mudassar Jamil",
        "Mudassar Jamil (Mudassar.Jamil@systemsltd.com)",
        "Mudassar.Jamil@systemsltd.com"
      ],
      "pseudonym_id": "PERSON_018",
      "email_count": 391
    },
    {
      "email_address": "shahzad.anwer@systemsltd.com",
      "canonical_name": "Shahzad Anwer",
      "aliases": [
        "Shahzad Anwer"
      ],
      "pseudonym_id": "PERSON_019",
      "email_count": 281
    },
    {
      "email_address": "jahangir.shahzad@systemsltd.com",
      "canonical_name": "Jahangir Shahzad",
      "aliases": [
        "Jahangir Shahzad"
      ],
      "pseudonym_id": "PERSON_020",
      "email_count": 97
    },
    {
      "email_address": "afshan.rauf@systemsltd.com",
      "canonical_name": "afshan rauf",
      "aliases": [
        "Afshan rauf",
        "afshan rauf"
      ],
      "pseudonym_id": "PERSON_021",
      "email_count": 36
    },
    {
      "email_address": "abdul.rauf@visionetsystems.com",
      "canonical_name": "Abdul Rauf (abdul.rauf@visionetsystems.com)",
      "aliases": [
        "Abdul Rauf",
        "Abdul Rauf (abdul.rauf@visionetsystems.com)"
      ],
      "pseudonym_id": "PERSON_022",
      "email_count": 325
    },
    {
      "email_address": "ahmad.rasheed@systemsltd.com",
      "canonical_name": "Muhammad Ahmad Rasheed",
      "aliases": [
        "Muhammad Ahmad Rasheed"
      ],
      "pseudonym_id": "PERSON_023",
      "email_count": 41
    },
    {
      "email_address": "aakif.mushtaq@systemsltd.com",
      "canonical_name": "Aakif Mushtaq",
      "aliases": [
        "Aakif Mushtaq"
      ],
      "pseudonym_id": "PERSON_024",
      "email_count": 55
    },
    {
      "email_address": "sohail.anwar@systemsltd.com",
      "canonical_name": "Muhammad Sohail Anwar",
      "aliases": [
        "Muhammad Sohail Anwar",
        "Sohail Anwar"
      ],
      "pseudonym_id": "PERSON_025",
      "email_count": 190
    },
    {
      "email_address": "khuram.shahzad@systemsltd.com",
      "canonical_name": "khuram shahzad Malik",
      "aliases": [
        "khuram shahzad Malik"
      ],
      "pseudonym_id": "PERSON_026",
      "email_count": 100
    },
    {
      "email_address": "ayyaz.ahmad@systemsltd.com",
      "canonical_name": "Ayyaz Ahmad",
      "aliases": [
        "Ayyaz Ahmad"
      ],
      "pseudonym_id": "PERSON_027",
      "email_count": 59
    },
    {
      "email_address": "tabish.lodhi@systemsltd.com",
      "canonical_name": "Tabish Bilal Lodhi",
      "aliases": [
        "Tabish Bilal Lodhi"
      ],
      "pseudonym_id": "PERSON_028",
      "email_count": 69
    },
    {
      "email_address": "adnan.ghauri@systemsltd.com",
      "canonical_name": "Adnan Ghauri",
      "aliases": [
        "Adnan Ghauri"
      ],
      "pseudonym_id": "PERSON_029",
      "email_count": 68
    },
    {
      "email_address": "shilpa.m@visionetsystems.com",
      "canonical_name": "Shilpa Maheshwari",
      "aliases": [
        "Shilpa Maheshwari"
      ],
      "pseudonym_id": "PERSON_030",
      "email_count": 134
    },
    {
      "email_address": "vijay.sp@visionetindia.com",
      "canonical_name": "vijay.sp@visionetindia.com",
      "aliases": [
        "vijay.sp@visionetindia.com"
      ],
      "pseudonym_id": "PERSON_031",
      "email_count": 1
    },
    {
      "email_address": "mian.ghous@systemsltd.com",
      "canonical_name": "Ghulam Ghous",
      "aliases": [
        "Ghulam Ghous",
        "Mian Ghous"
      ],
      "pseudonym_id": "PERSON_032",
      "email_count": 77
    },
    {
      "email_address": "tayyabnawaz.sulehri@systemsltd.com",
      "canonical_name": "Tayyab Nawaz Sulehri",
      "aliases": [
        "Tayyab Nawaz Sulehri"
      ],
      "pseudonym_id": "PERSON_033",
      "email_count": 91
    },
    {
      "email_address": "wahab.aziz@systemsltd.com",
      "canonical_name": "Abdul Wahab",
      "aliases": [
        "Abdul Wahab"
      ],
      "pseudonym_id": "PERSON_034",
      "email_count": 55
    },
    {
      "email_address": "sadia.akhter@systemsltd.com",
      "canonical_name": "Sadia Akhtar SL",
      "aliases": [
        "Sadia Akhtar SL",
        "Sadia Akhter"
      ],
      "pseudonym_id": "PERSON_035",
      "email_count": 33
    },
    {
      "email_address": "aliraza.shafique@systemsltd.com",
      "canonical_name": "Ali Raza Shafique",
      "aliases": [
        "Ali Raza Shafique"
      ],
      "pseudonym_id": "PERSON_036",
      "email_count": 14
    },
    {
      "email_address": "uzma.mansoor@systemsltd.com",
      "canonical_name": "Uzma Mansoor",
      "aliases": [
        "Uzma Mansoor"
      ],
      "pseudonym_id": "PERSON_037",
      "email_count": 73
    },
    {
      "email_address": "amen.ijaz@systemsltd.com",
      "canonical_name": "Amen Ijaz",
      "aliases": [
        "Amen Ijaz",
        "amen ijaz"
      ],
      "pseudonym_id": "PERSON_038",
      "email_count": 49
    },
    {
      "email_address": "usman.arshad@systemsltd.com",
      "canonical_name": "Muhammad Usman Arshad",
      "aliases": [
        "Muhammad Usman Arshad"
      ],
      "pseudonym_id": "PERSON_039",
      "email_count": 39
    },
    {
      "email_address": "muhammad.akmal@systemsltd.com",
      "canonical_name": "Muhammad Akmal",